{
  "first_clear_meta_lv01": 100.0,
  "first_clear_meta_lv02": 150.0,
  "first_clear_meta_lv03": 200.0,
  "first_clear_meta_lv04": 250.0,
  "first_clear_meta_lv05": 300.0,
  "repeat_meta_lv01": 20.0,
  "repeat_meta_lv02": 30.0,
  "repeat_meta_lv03": 40.0,
  "repeat_meta_lv04": 50.0,
  "repeat_meta_lv05": 60.0
}